<?xml version="1.0" encoding="iso-8859-1" standalone="yes"?>
<schema xmlns:xsd="http://www.w3.org/2000/10/XMLSchema">

<annotation>
  <documentation>
  Schema for JDiff API representation.
  </documentation>
</annotation>

<xsd:element name="api" type="apiType">
<xsd:complexType name="apiType">
  <xsd:attribute name="name" type="xsd:string"/>
  <xsd:attribute name="jdversion" type="xsd:string"/>
  <xsd:sequence>
    <xsd:element name="package" type="packageType" minOccurs='1' maxOccurs='unbounded'/>
  </xsd:sequence>
</xsd:complexType>

<xsd:complexType name="packageType">
  <xsd:attribute name="name" type="xsd:string"/>
  <xsd:sequence>
    <xsd:element name="class" type="classType" minOccurs='1' maxOccurs='unbounded'/>
    <xsd:element name="doc" type="CDATA" minOccurs='0' maxOccurs='1'/>
  </xsd:sequence>
</xsd:complexType>

<xsd:complexType name="classType">
  <xsd:attribute name="name" type="xsd:string"/>
  <xsd:attribute name="extends" type="xsd:string" use='optional'/>
  <xsd:attribute name="abstract" type="xsd:boolean"/>
  <xsd:attribute name="static" type="xsd:boolean"/>
  <xsd:attribute name="final" type="xsd:boolean"/>
  <xsd:attribute name="deprecated" type="xsd:string"/>
  <xsd:attribute name="visibility" type="xsd:string"/>
  <xsd:sequence>
    <xsd:element name="implements" type="interfaceType" minOccurs='0' maxOccurs='unbounded'/>
    <xsd:element name="constructor" type="constructorType" minOccurs='1' maxOccurs='unbounded'/>
    <xsd:element name="method" type="methodType" minOccurs='0' maxOccurs='unbounded'/>
    <xsd:element name="field" type="fieldType" minOccurs='0' maxOccurs='unbounded'/>
    <xsd:element name="doc" type="CDATA" minOccurs='0' maxOccurs='1'/>
  </xsd:sequence>
</xsd:complexType>

<xsd:complexType name="interfaceType">
  <xsd:attribute name="name" type="xsd:string"/>
</xsd:complexType>

<xsd:complexType name="constructorType">
  <xsd:attribute name="name" type="xsd:string"/>
  <xsd:attribute name="type" type="xsd:string" use='optional'/>
  <xsd:attribute name="static" type="xsd:boolean"/>
  <xsd:attribute name="final" type="xsd:boolean"/>
  <xsd:attribute name="deprecated" type="xsd:string"/>
  <xsd:attribute name="visibility" type="xsd:string"/>
  <xsd:sequence>
    <xsd:element name="exception" type="exceptionType" minOccurs='0' maxOccurs='unbounded'/>
    <xsd:element name="doc" type="CDATA" minOccurs='0' maxOccurs='1'/>
  </xsd:sequence>
</xsd:complexType>

<xsd:complexType name="paramsType">
  <xsd:attribute name="name" type="xsd:string"/>
  <xsd:attribute name="type" type="xsd:string"/>
</xsd:complexType>

<xsd:complexType name="exceptionType">
  <xsd:attribute name="name" type="xsd:string"/>
</xsd:complexType>

<xsd:complexType name="methodType">
  <xsd:attribute name="name" type="xsd:string"/>
  <xsd:attribute name="return" type="xsd:string" use='optional'/>
  <xsd:attribute name="abstract" type="xsd:boolean"/>
  <xsd:attribute name="native" type="xsd:boolean"/>
  <xsd:attribute name="synchronized" type="xsd:boolean"/>
  <xsd:attribute name="static" type="xsd:boolean"/>
  <xsd:attribute name="final" type="xsd:boolean"/>
  <xsd:attribute name="deprecated" type="xsd:string"/>
  <xsd:attribute name="visibility" type="xsd:string"/>
  <xsd:sequence>
    <xsd:element name="exception" type="exceptionType" minOccurs='0' maxOccurs='unbounded'/>
    <xsd:element name="params" type="paramsType" minOccurs='0' maxOccurs='unbounded'/>
    <xsd:element name="doc" type="CDATA" minOccurs='0' maxOccurs='1'/>
  </xsd:sequence>
</xsd:complexType>

<xsd:complexType name="fieldType">
  <xsd:attribute name="name" type="xsd:string"/>
  <xsd:attribute name="type" type="xsd:string"/>
  <xsd:attribute name="transient" type="xsd:boolean"/>
  <xsd:attribute name="volatile" type="xsd:boolean"/>
  <xsd:attribute name="static" type="xsd:boolean"/>
  <xsd:attribute name="final" type="xsd:boolean"/>
  <xsd:attribute name="deprecated" type="xsd:string"/>
  <xsd:attribute name="visibility" type="xsd:string"/>
  <xsd:sequence>
    <xsd:element name="doc" type="CDATA" minOccurs='0' maxOccurs='1'/>
  </xsd:sequence>
</xsd:complexType>

</xsd:element>

</schema>